[
  {
    "claim": "Reference cutlass_ampere_tf32_gemm is frozen to https://github.com/NVIDIA/cutlass @ e13f5cd4142c43efc37c2f6339923eb4a57afb99 and decomposed by hand into Reference, Chain, Reconstruction and one Gap per unmatched transaction, with path:line citations at that commit (analysis of source only; not built or run)",
    "command": "git clone --depth 1 https://github.com/NVIDIA/cutlass <cache> && git -C <cache> rev-parse HEAD  # then hand decomposition per src/kta/agents/skills/decompose-kernel/SKILL.md",
    "git_commit": "3a614fabf6693b020344d708197ec17356b5a4ca",
    "dirty": false,
    "env": "dev",
    "control_host": "dingyideMacBook-Pro.local",
    "workers": [],
    "record_ids": [],
    "blob_ids": [],
    "env_manifests": [],
    "started_at": "2026-10-30T04:04:03Z",
    "output": "knowledge/seed/references/cutlass_ampere_tf32_gemm/",
    "notes": "No store records: WP10a is not record-backed (D84). The upstream clone was kept in a session scratch cache outside git; source.yaml holds URL and commit for re-fetching."
  },
  {
    "claim": "Reference flash_attention_2_fwd is frozen to https://github.com/Dao-AILab/flash-attention @ a3a9dfa9bf10b52e55e8507b16ab0fe0dc1f38a0 and decomposed by hand into Reference, Chain, Reconstruction and one Gap per unmatched transaction, with path:line citations at that commit (analysis of source only; not built or run)",
    "command": "git clone --depth 1 https://github.com/Dao-AILab/flash-attention <cache> && git -C <cache> rev-parse HEAD  # then hand decomposition per src/kta/agents/skills/decompose-kernel/SKILL.md",
    "git_commit": "3a614fabf6693b020344d708197ec17356b5a4ca",
    "dirty": false,
    "env": "dev",
    "control_host": "dingyideMacBook-Pro.local",
    "workers": [],
    "record_ids": [],
    "blob_ids": [],
    "env_manifests": [],
    "started_at": "2026-10-30T04:03:53Z",
    "output": "knowledge/seed/references/flash_attention_2_fwd/",
    "notes": "No store records: WP10a is not record-backed (D84). The upstream clone was kept in a session scratch cache outside git; source.yaml holds URL and commit for re-fetching."
  },
  {
    "claim": "Reference flash_attention_3_fwd is frozen to https://github.com/Dao-AILab/flash-attention @ a3a9dfa9bf10b52e55e8507b16ab0fe0dc1f38a0 and decomposed by hand into Reference, Chain, Reconstruction and one Gap per unmatched transaction, with path:line citations at that commit (analysis of source only; not built or run)",
    "command": "git clone --depth 1 https://github.com/Dao-AILab/flash-attention <cache> && git -C <cache> rev-parse HEAD  # then hand decomposition per src/kta/agents/skills/decompose-kernel/SKILL.md",
    "git_commit": "3a614fabf6693b020344d708197ec17356b5a4ca",
    "dirty": false,
    "env": "dev",
    "control_host": "dingyideMacBook-Pro.local",
    "workers": [],
    "record_ids": [],
    "blob_ids": [],
    "env_manifests": [],
    "started_at": "2026-10-30T04:03:53Z",
    "output": "knowledge/seed/references/flash_attention_3_fwd/",
    "notes": "No store records: WP10a is not record-backed (D84). The upstream clone was kept in a session scratch cache outside git; source.yaml holds URL and commit for re-fetching."
  },
  {
    "claim": "Reference marlin_int4_gemm is frozen to https://github.com/IST-DASLab/marlin @ 1f25790bdd49fba53106164a24666dade68d7c90 and decomposed by hand into Reference, Chain, Reconstruction and one Gap per unmatched transaction, with path:line citations at that commit (analysis of source only; not built or run)",
    "command": "git clone --depth 1 https://github.com/IST-DASLab/marlin <cache> && git -C <cache> rev-parse HEAD  # then hand decomposition per src/kta/agents/skills/decompose-kernel/SKILL.md",
    "git_commit": "3a614fabf6693b020344d708197ec17356b5a4ca",
    "dirty": false,
    "env": "dev",
    "control_host": "dingyideMacBook-Pro.local",
    "workers": [],
    "record_ids": [],
    "blob_ids": [],
    "env_manifests": [],
    "started_at": "2026-10-30T04:03:51Z",
    "output": "knowledge/seed/references/marlin_int4_gemm/",
    "notes": "No store records: WP10a is not record-backed (D84). The upstream clone was kept in a session scratch cache outside git; source.yaml holds URL and commit for re-fetching."
  },
  {
    "claim": "Reference flashinfer_batch_decode is frozen to https://github.com/flashinfer-ai/flashinfer @ 732134f2ff4da63268b01c7c4ef9f61e9a1b8a43 and decomposed by hand into Reference, Chain, Reconstruction and one Gap per unmatched transaction, with path:line citations at that commit (analysis of source only; not built or run)",
    "command": "git clone --depth 1 https://github.com/flashinfer-ai/flashinfer <cache> && git -C <cache> rev-parse HEAD  # then hand decomposition per src/kta/agents/skills/decompose-kernel/SKILL.md",
    "git_commit": "3a614fabf6693b020344d708197ec17356b5a4ca",
    "dirty": false,
    "env": "dev",
    "control_host": "dingyideMacBook-Pro.local",
    "workers": [],
    "record_ids": [],
    "blob_ids": [],
    "env_manifests": [],
    "started_at": "2026-10-30T04:04:20Z",
    "output": "knowledge/seed/references/flashinfer_batch_decode/",
    "notes": "No store records: WP10a is not record-backed (D84). The upstream clone was kept in a session scratch cache outside git; source.yaml holds URL and commit for re-fetching."
  },
  {
    "claim": "Reference vllm_fused_moe is frozen to https://github.com/vllm-project/vllm @ 2eae56c4ba0cf12087fec035514eedede83c257d and decomposed by hand into Reference, Chain, Reconstruction and one Gap per unmatched transaction, with path:line citations at that commit (analysis of source only; not built or run)",
    "command": "git clone --depth 1 https://github.com/vllm-project/vllm <cache> && git -C <cache> rev-parse HEAD  # then hand decomposition per src/kta/agents/skills/decompose-kernel/SKILL.md",
    "git_commit": "3a614fabf6693b020344d708197ec17356b5a4ca",
    "dirty": false,
    "env": "dev",
    "control_host": "dingyideMacBook-Pro.local",
    "workers": [],
    "record_ids": [],
    "blob_ids": [],
    "env_manifests": [],
    "started_at": "2026-10-30T04:04:03Z",
    "output": "knowledge/seed/references/vllm_fused_moe/",
    "notes": "No store records: WP10a is not record-backed (D84). The upstream clone was kept in a session scratch cache outside git; source.yaml holds URL and commit for re-fetching."
  },
  {
    "claim": "Reference vllm_rms_norm is frozen to https://github.com/vllm-project/vllm @ 2eae56c4ba0cf12087fec035514eedede83c257d and decomposed by hand into Reference, Chain, Reconstruction and one Gap per unmatched transaction, with path:line citations at that commit (analysis of source only; not built or run)",
    "command": "git clone --depth 1 https://github.com/vllm-project/vllm <cache> && git -C <cache> rev-parse HEAD  # then hand decomposition per src/kta/agents/skills/decompose-kernel/SKILL.md",
    "git_commit": "3a614fabf6693b020344d708197ec17356b5a4ca",
    "dirty": false,
    "env": "dev",
    "control_host": "dingyideMacBook-Pro.local",
    "workers": [],
    "record_ids": [],
    "blob_ids": [],
    "env_manifests": [],
    "started_at": "2026-10-30T04:04:03Z",
    "output": "knowledge/seed/references/vllm_rms_norm/",
    "notes": "No store records: WP10a is not record-backed (D84). The upstream clone was kept in a session scratch cache outside git; source.yaml holds URL and commit for re-fetching."
  },
  {
    "claim": "All seven reference directories satisfy the WP10a layout: each has Reference, Chain and Reconstruction YAML, and the Gap count equals len(unmatched_transactions); totals 135 chain steps, 99 matched, 55 unmatched transactions = 55 Gaps, 30 proposed Templates, 3 proposed Patterns",
    "command": "KTA_DATA=~/kta-data scripts/gate WP10a",
    "git_commit": "3a614fabf6693b020344d708197ec17356b5a4ca",
    "dirty": false,
    "env": "dev",
    "control_host": "dingyideMacBook-Pro.local",
    "workers": [],
    "record_ids": [],
    "blob_ids": [],
    "env_manifests": [],
    "started_at": "2026-10-30T04:50:00Z",
    "output": "deliveries/WP10a.md (Gate output section)",
    "notes": "YAML is parsed but not model-validated until WP1 provides kta.core.schemas (gate WARN 'reference schemas'). Field-level checks were done with a scratch transcription of spec/schemas.md, not committed."
  }
]
