[
  {
    "git_commit": "41cc17f6baec3b0ab9b6611508989d0e147bbf8d",
    "dirty": false,
    "env": "dev",
    "control_host": "Mac.lan",
    "workers": [],
    "record_ids": [],
    "blob_ids": [],
    "env_manifests": [],
    "requires_gpu": false,
    "claim": "WP14 tests (old-format records read back upcast with unchanged IDs; levels 0-5 mapped to 1-7; unprobed Template filtered on GB10 and counted; a target declaring a capability wakes it up; capability inferred from an ISA probe; ladder evidence rules; demotion with stale propagation; system-only demotion; promotion review; pool diff incl. GET /pool/diff; idempotent seed migration) and the knowledge, schema, SASS-expectation and locked WP1/WP4 acceptance tests pass: 108 passed. Code stage (D320): unit tests on test stores, no real run.",
    "command": "uv run --frozen pytest -v tests/unit/test_wp14_knowledge_v2.py tests/unit/test_knowledge_pool.py tests/unit/test_knowledge_use.py tests/unit/test_core_ids_schemas.py tests/unit/test_wp7_family.py tests/unit/test_orchestrator_wiring.py tests/acceptance/WP4 tests/acceptance/WP1",
    "started_at": "2026-10-30T23:09:44Z",
    "output": "Mac.lan:~/kta-data/dev/WP14-code-41cc17f/evidence/pytest-41cc17f.txt"
  },
  {
    "git_commit": "41cc17f6baec3b0ab9b6611508989d0e147bbf8d",
    "dirty": false,
    "env": "dev",
    "control_host": "Mac.lan",
    "workers": [],
    "record_ids": [],
    "blob_ids": [],
    "env_manifests": [],
    "requires_gpu": false,
    "claim": "The seed migration reports nothing pending, and the seed plus the seven WP10a references import under schema v2 into a fresh dev store: seed 58 records (16 Capability, 16 CapabilityDecl for gb10, 7 Template, 1 Realisation), references 139 (30 Template, 17 Realisation). No measurement involved.",
    "command": "uv run --frozen python scripts/migrations/WP14_knowledge_v2.py --check; KTA_ENV=dev KTA_WP=WP14-code-41cc17f KTA_DATA=~/kta-data uv run --frozen kta init --references",
    "started_at": "2026-10-30T23:09:56Z",
    "output": "Mac.lan:~/kta-data/dev/WP14-code-41cc17f/evidence/seed-41cc17f.txt",
    "notes": "dev store ~/kta-data/dev/WP14-code-41cc17f holds import records only (origin real, seed data); no run-backed claim rests on them"
  },
  {
    "git_commit": "41cc17f6baec3b0ab9b6611508989d0e147bbf8d",
    "dirty": false,
    "env": "dev",
    "control_host": "Mac.lan",
    "workers": [],
    "record_ids": [],
    "blob_ids": [],
    "env_manifests": [],
    "requires_gpu": false,
    "claim": "Every record of a copy (sqlite .backup, read-only source) of the existing store ~/kta-data/dev/integration/kta.db reads back through the WP14 Record model with its ID unchanged: 201 records, upcast Pattern v1 11, Template v1 35, Gap v1 55, Reconstruction v1 7, 0 problems. The original store was not modified.",
    "command": "sqlite3 -readonly ~/kta-data/dev/integration/kta.db \".backup <scratch>/kta.db\"; uv run --frozen python readback.py <scratch>/kta.db",
    "started_at": "2026-10-30T23:10:15Z",
    "output": "Mac.lan:~/kta-data/dev/WP14-code-41cc17f/evidence/readback-integration-41cc17f.txt",
    "notes": "readback.py is kept next to the output"
  },
  {
    "git_commit": "41cc17f6baec3b0ab9b6611508989d0e147bbf8d",
    "dirty": false,
    "env": "dev",
    "control_host": "Mac.lan",
    "workers": [],
    "record_ids": [],
    "blob_ids": [],
    "env_manifests": [],
    "requires_gpu": false,
    "claim": "The web frontend (levels 1-7, requires/probed_on, the /pool/diff page) type-checks and builds from git archive HEAD web in a fresh directory with the lockfile-installed node_modules linked in.",
    "command": "T=$(mktemp -d) && git archive --format=tar HEAD web | tar -x -C $T && ln -s $PWD/web/node_modules $T/web/node_modules && cd $T/web && npm run build",
    "started_at": "2026-10-30T23:09:55Z",
    "output": "Mac.lan:~/kta-data/dev/WP14-code-41cc17f/evidence/web-build-41cc17f.txt"
  }
]
