[
  {
    "claim": "kta init in KTA_ENV=dev created the WP4 dev store and imported the seed in one validated batch: 1 Source, 8 Patterns, 9 Structures and the five paper GEMM-step Templates (each validated with validate_template against the store plus the batch before writing)",
    "command": "KTA_ENV=dev KTA_WP=WP4 KTA_DATA=~/kta-data uv run kta init --json",
    "record_ids": [
      "e2b17266434f0aa8958c71a7c9ba5d46e1f758a4a33573e1c6fbc29f5faa7b05",
      "71505295a9f77e8d4b1e57e13dbcdee7f8d3fea5b37f06feb36af7ed159859f6",
      "dd3958cc5c94b5949fa80e70112726b824a597f4fef0c165789656917275f45c",
      "70ce133e4abc330b75e672d54423d49d58a1e423e34e70b6ec29eacd1287ef07",
      "59350d3fac1f752808f101360f59891f5722444c0097445e4bc63162a7919e88",
      "19e16d40396e3cd6a1ed0ec9d7c6bf183ea4c175c1b317b2422e09018480270c",
      "7879c6f8294bff5a6731ea5ab7d63e98989af117f72dd7f89f6db48576d3c9f8",
      "3e4c6f044254f13f17055795e1ac8d7e47499573db7315060d4d27d3ca76d8fa",
      "e1c9fb2588b4141714dc1bde5491dad85385553961732d07414c5e74d0526e5f",
      "5e71bc693e1d1464acf2b993675531ce43acf27f9d588e4c2c8ef94aa9931711",
      "99d2896399119e0fa9f5bf39429134fcd33a32f5a7f3abe0e42c23f2f1d91e90",
      "876cea230ed3d6539c78b799a2ad2896f62371ef0cd4e64d8d30b86fd6aed92e",
      "9135db56bc2e42b57a76207a100db310e93cb125a48c686795d2adce879909e9",
      "7bf6b9ddf8adab7a5109a29bd22c1b9e5db05354169b61fc871b80e43ed4cb47",
      "fdd77a58053d5a162e2991dfa7fdac010b8600b10014195f0cebc50f2deabbd6",
      "a90420dac3c4748e7cad2fc6ba0f5964dea39702cabe69eb6e42b670498cb2cf",
      "7e90cc8d0f2862b3cfd6009022c56f549cc3519e6390c2c1d09407b41b79cabb",
      "1aae2d425ec8366b3fcbfa369de41c6d5571c505f8b92a02239b47175a2017ec",
      "b0d0e941deb60f13a4c21618e51c0877fbe3882a6164e14ee8aabe3e70c45540",
      "830b10311527d61f0c7b6f6d4626b15c456e42328041e1bd2d6029ad67bcb796",
      "e0e1ff8adfcd91a8cb07f2651833f1a1d446bb21930ef837ecd448be69bd8703",
      "c86d8e4d5b7d741f30050151a9c0fef8b0f0011a4e9db81650df53d3dc2c0857",
      "b6def53608f6de62ab44f4ee296bc2364cac96fc19d9c93b9840ea0addfb1497"
    ],
    "git_commit": "f0cb2d01c9c816733dba01439c8788752936950c",
    "dirty": false,
    "env": "dev",
    "control_host": "dingyideMacBook-Pro.local",
    "workers": [],
    "blob_ids": [],
    "env_manifests": [],
    "started_at": "2026-10-30T05:31:51Z"
  },
  {
    "claim": "Running kta init again wrote no record and reused all 23 seed records (idempotent import)",
    "command": "KTA_ENV=dev KTA_WP=WP4 KTA_DATA=~/kta-data uv run kta init",
    "record_ids": [
      "e2b17266434f0aa8958c71a7c9ba5d46e1f758a4a33573e1c6fbc29f5faa7b05",
      "71505295a9f77e8d4b1e57e13dbcdee7f8d3fea5b37f06feb36af7ed159859f6",
      "dd3958cc5c94b5949fa80e70112726b824a597f4fef0c165789656917275f45c",
      "70ce133e4abc330b75e672d54423d49d58a1e423e34e70b6ec29eacd1287ef07",
      "59350d3fac1f752808f101360f59891f5722444c0097445e4bc63162a7919e88",
      "19e16d40396e3cd6a1ed0ec9d7c6bf183ea4c175c1b317b2422e09018480270c",
      "7879c6f8294bff5a6731ea5ab7d63e98989af117f72dd7f89f6db48576d3c9f8",
      "3e4c6f044254f13f17055795e1ac8d7e47499573db7315060d4d27d3ca76d8fa",
      "e1c9fb2588b4141714dc1bde5491dad85385553961732d07414c5e74d0526e5f",
      "5e71bc693e1d1464acf2b993675531ce43acf27f9d588e4c2c8ef94aa9931711",
      "99d2896399119e0fa9f5bf39429134fcd33a32f5a7f3abe0e42c23f2f1d91e90",
      "876cea230ed3d6539c78b799a2ad2896f62371ef0cd4e64d8d30b86fd6aed92e",
      "9135db56bc2e42b57a76207a100db310e93cb125a48c686795d2adce879909e9",
      "7bf6b9ddf8adab7a5109a29bd22c1b9e5db05354169b61fc871b80e43ed4cb47",
      "fdd77a58053d5a162e2991dfa7fdac010b8600b10014195f0cebc50f2deabbd6",
      "a90420dac3c4748e7cad2fc6ba0f5964dea39702cabe69eb6e42b670498cb2cf",
      "7e90cc8d0f2862b3cfd6009022c56f549cc3519e6390c2c1d09407b41b79cabb",
      "1aae2d425ec8366b3fcbfa369de41c6d5571c505f8b92a02239b47175a2017ec",
      "b0d0e941deb60f13a4c21618e51c0877fbe3882a6164e14ee8aabe3e70c45540",
      "830b10311527d61f0c7b6f6d4626b15c456e42328041e1bd2d6029ad67bcb796",
      "e0e1ff8adfcd91a8cb07f2651833f1a1d446bb21930ef837ecd448be69bd8703",
      "c86d8e4d5b7d741f30050151a9c0fef8b0f0011a4e9db81650df53d3dc2c0857",
      "b6def53608f6de62ab44f4ee296bc2364cac96fc19d9c93b9840ea0addfb1497"
    ],
    "git_commit": "f0cb2d01c9c816733dba01439c8788752936950c",
    "dirty": false,
    "env": "dev",
    "control_host": "dingyideMacBook-Pro.local",
    "workers": [],
    "blob_ids": [],
    "env_manifests": [],
    "started_at": "2026-10-30T05:31:51Z"
  }
]
