[
  {
    "claim": "WP10b tests pass: the expand machine produces exactly the machines.yaml transitions; one T3 per Template the chain names that the pool lacks; gap waits until every task settles, cancelled T3s go on to reconstructed, re-match bounded by max_rounds; WP10a's 7 references replay frozen -> covered through the human submission path (12 T2, 30 T3 accepted; final coverage 99/135 matched, 55 Gaps, nothing left to extract); the same through the kta CLI for cutlass; an inflated matched count is rejected; coverage counts the latest Reconstruction per Reference; page fields; gate checks. Unit runs, no GPU",
    "command": "uv run --frozen pytest -v tests/unit/test_expand_replay.py tests/unit/test_expand_cli.py tests/unit/test_orchestrator_step.py tests/unit/test_orchestrator_tasks.py tests/unit/test_knowledge_use.py tests/unit/test_gate_wp10b.py",
    "git_commit": "a6fba10a27ae4ccdd8d1110c2b4a138104559007",
    "dirty": false,
    "env": "dev",
    "control_host": "Mac.lan",
    "workers": [],
    "record_ids": [],
    "blob_ids": [],
    "env_manifests": [],
    "started_at": "2026-10-30T18:58:00Z",
    "requires_gpu": false,
    "output": "Mac.lan:~/kta-data/dev/WP10b-replay/evidence/pytest-a6fba10.txt"
  },
  {
    "claim": "A real dev-store run of the expand loop with kta commands only (scripts/replay-references): kta init, then for each of WP10a's 7 references kta reference add, kta expand --analysis-only, kta task submit --check for every T2/T3 the loop created (WP10a's hand decomposition files, unchanged), kta loop step until covered. All 7 loops reached covered; the last coverage Report (subject = a PoolSnapshot, served by the API's /coverage view) gives 7 references, 35 Templates observed, Chao1 47.0 (95% 38.2-80.3), Good-Turing 0.891, 55 Gaps (37 template, 7 other, 6 family, 3 pattern, 1 relation, 1 check), 0 Templates left to extract. Analysis only: nothing built, run or measured, no agent ran",
    "command": "KTA_ENV=dev KTA_WP=WP10b-replay KTA_DATA=~/kta-data scripts/replay-references --init",
    "git_commit": "b65457db5799d2cbacb5f002d2bfcb68fd7290ec",
    "dirty": false,
    "env": "dev",
    "control_host": "Mac.lan",
    "workers": [],
    "record_ids": [
      "259b8b28ce45b1403fefa4d9a6f113d340bd77ed2c9958b6a43948c2b7dc17f9"
    ],
    "blob_ids": [],
    "env_manifests": [],
    "started_at": "2026-10-30T18:55:00Z",
    "requires_gpu": false,
    "output": "Mac.lan:~/kta-data/dev/WP10b-replay/evidence/replay-b65457d.txt"
  }
]
